{
  "schema_version": "1.0.0",
  "id": "doc-3c011e0dabec",
  "title": "5a16ad5fbbd44a18950f975615aab5db",
  "language": "pt-BR",
  "verbosity": "detailed",
  "audience": [
    "reader"
  ],
  "metadata": {
    "page_count": 1,
    "mode": "normal",
    "pages": [
      {
        "page_number": 1,
        "file_path": "C:\\Users\\JHONATA\\AppData\\Local\\Temp\\a11y-devs-describer\\temp\\uploads\\5a16ad5fbbd44a18950f975615aab5db.jpg",
        "text": "O jovem tem cabelo preto, curto e com textura crespa. Ele tem barba e bigode escuros, com pelos também crespos. Seu sorriso revela dentes brancos e ele está olhando para a esquerda, com os olhos castanhos. Ele está usando uma camisa verde com mangas curtas e um decote em V. As mangas têm um design branco com detalhes pretos, que parecem ser padrões geométricos ou de animais. O fundo mostra um ambiente interno, com um refrigerador branco à direita. O refrigerador tem vários papéis colados na frente, incluindo fotos e textos, mas o conteúdo é ilegível. Há também um pano vermelho pendurado no lado direito do refrigerador. O jovem está posicionado no centro da imagem, com o rosto voltado para a esquerda e o corpo parcialmente virado para a frente. A iluminação é natural, e o ambiente parece ser uma cozinha ou área de serviço.",
        "blocks": [
          {
            "type": "paragraph",
            "text": "O jovem tem cabelo preto, curto e com textura crespa. Ele tem barba e bigode escuros, com pelos também crespos. Seu sorriso revela dentes brancos e ele está olhando para a esquerda, com os olhos castanhos. Ele está usando uma camisa verde com mangas curtas e um decote em V. As mangas têm um design branco com detalhes pretos, que parecem ser padrões geométricos ou de animais. O fundo mostra um ambiente interno, com um refrigerador branco à direita. O refrigerador tem vários papéis colados na frente, incluindo fotos e textos, mas o conteúdo é ilegível. Há também um pano vermelho pendurado no lado direito do refrigerador. O jovem está posicionado no centro da imagem, com o rosto voltado para a esquerda e o corpo parcialmente virado para a frente. A iluminação é natural, e o ambiente parece ser uma cozinha ou área de serviço.",
            "id": "blk-22a388082c-1"
          }
        ],
        "cached": false
      }
    ]
  },
  "source": {
    "name": "5a16ad5fbbd44a18950f975615aab5db.jpg",
    "path": "C:\\Users\\JHONATA\\AppData\\Local\\Temp\\a11y-devs-describer\\temp\\uploads\\5a16ad5fbbd44a18950f975615aab5db.jpg",
    "type": ".jpg"
  },
  "accessibility": {
    "navigation": true,
    "semantic_headings": true,
    "internal_links": true
  },
  "technical_warnings": [],
  "audit": {
    "generated_by": "canonical_builder",
    "input_length": 5,
    "block_count": 1
  },
  "sections": [
    {
      "id": "blk-22a388082c-1",
      "title": "",
      "level": 1,
      "source_location": {},
      "metadata": {},
      "blocks": [
        {
          "type": "paragraph",
          "text": "O jovem tem cabelo preto, curto e com textura crespa. Ele tem barba e bigode escuros, com pelos também crespos. Seu sorriso revela dentes brancos e ele está olhando para a esquerda, com os olhos castanhos. Ele está usando uma camisa verde com mangas curtas e um decote em V. As mangas têm um design branco com detalhes pretos, que parecem ser padrões geométricos ou de animais. O fundo mostra um ambiente interno, com um refrigerador branco à direita. O refrigerador tem vários papéis colados na frente, incluindo fotos e textos, mas o conteúdo é ilegível. Há também um pano vermelho pendurado no lado direito do refrigerador. O jovem está posicionado no centro da imagem, com o rosto voltado para a esquerda e o corpo parcialmente virado para a frente. A iluminação é natural, e o ambiente parece ser uma cozinha ou área de serviço.",
          "id": "blk-22a388082c-1"
        }
      ],
      "children": []
    }
  ]
}