{
  "schema_version": "1.0.0",
  "id": "doc-9d636bd72549",
  "title": "2a5471fce736490184b572a8c76ae2b3",
  "language": "pt-BR",
  "verbosity": "detailed",
  "audience": [
    "reader"
  ],
  "metadata": {
    "page_count": 1,
    "mode": "normal",
    "pages": [
      {
        "page_number": 1,
        "file_path": "C:\\Users\\JHONATA\\AppData\\Local\\Temp\\a11y-devs-describer\\temp\\uploads\\2a5471fce736490184b572a8c76ae2b3.png",
        "text": "O logotipo está posicionado no centro da imagem. Ele é composto por um círculo azul escuro com uma silhueta de perfil humano em azul escuro, voltada para a direita. Dentro do círculo, há um documento estilizado com uma aba dobrada no canto superior direito. O documento contém dois elementos principais: um quadrado azul escuro com uma imagem de montanha e sol em branco, e uma tabela verde com seis células brancas. À direita do documento, há três linhas horizontais azuis escuras. No lado esquerdo do círculo, há uma série de pontos azuis e verdes dispostos em três linhas verticais, variando de tamanho. No lado inferior direito do círculo, há duas setas verdes que se parecem com ondas sonoras. Abaixo do logotipo, o texto \"acessilia\" está escrito em duas partes: \"acess\" em azul escuro e \"ilia\" em verde. Uma linha horizontal azul escura com pontos azuis nos extremos separa o logotipo do texto. Abaixo da linha, o texto \"TRANSFORMANDO DOCUMENTOS.\" está em azul escuro, seguido por \"GERANDO ACESSIBILIDADE.\" em verde. No final, há quatro ícones: um quadrado com seis pontos azuis, um ícone de volume, um ícone de olho e um ícone de documento com três linhas horizontais. Todos os elementos estão sobre um fundo branco.",
        "blocks": [
          {
            "type": "paragraph",
            "text": "O logotipo está posicionado no centro da imagem. Ele é composto por um círculo azul escuro com uma silhueta de perfil humano em azul escuro, voltada para a direita. Dentro do círculo, há um documento estilizado com uma aba dobrada no canto superior direito. O documento contém dois elementos principais: um quadrado azul escuro com uma imagem de montanha e sol em branco, e uma tabela verde com seis células brancas. À direita do documento, há três linhas horizontais azuis escuras. No lado esquerdo do círculo, há uma série de pontos azuis e verdes dispostos em três linhas verticais, variando de tamanho. No lado inferior direito do círculo, há duas setas verdes que se parecem com ondas sonoras. Abaixo do logotipo, o texto \"acessilia\" está escrito em duas partes: \"acess\" em azul escuro e \"ilia\" em verde. Uma linha horizontal azul escura com pontos azuis nos extremos separa o logotipo do texto. Abaixo da linha, o texto \"TRANSFORMANDO DOCUMENTOS.\" está em azul escuro, seguido por \"GERANDO ACESSIBILIDADE.\" em verde. No final, há quatro ícones: um quadrado com seis pontos azuis, um ícone de volume, um ícone de olho e um ícone de documento com três linhas horizontais. Todos os elementos estão sobre um fundo branco.",
            "id": "blk-ded34735bd-1"
          }
        ],
        "cached": false
      }
    ]
  },
  "source": {
    "name": "2a5471fce736490184b572a8c76ae2b3.png",
    "path": "C:\\Users\\JHONATA\\AppData\\Local\\Temp\\a11y-devs-describer\\temp\\uploads\\2a5471fce736490184b572a8c76ae2b3.png",
    "type": ".png"
  },
  "accessibility": {
    "navigation": true,
    "semantic_headings": true,
    "internal_links": true
  },
  "technical_warnings": [],
  "audit": {
    "generated_by": "canonical_builder",
    "input_length": 5,
    "block_count": 1
  },
  "sections": [
    {
      "id": "blk-ded34735bd-1",
      "title": "",
      "level": 1,
      "source_location": {},
      "metadata": {},
      "blocks": [
        {
          "type": "paragraph",
          "text": "O logotipo está posicionado no centro da imagem. Ele é composto por um círculo azul escuro com uma silhueta de perfil humano em azul escuro, voltada para a direita. Dentro do círculo, há um documento estilizado com uma aba dobrada no canto superior direito. O documento contém dois elementos principais: um quadrado azul escuro com uma imagem de montanha e sol em branco, e uma tabela verde com seis células brancas. À direita do documento, há três linhas horizontais azuis escuras. No lado esquerdo do círculo, há uma série de pontos azuis e verdes dispostos em três linhas verticais, variando de tamanho. No lado inferior direito do círculo, há duas setas verdes que se parecem com ondas sonoras. Abaixo do logotipo, o texto \"acessilia\" está escrito em duas partes: \"acess\" em azul escuro e \"ilia\" em verde. Uma linha horizontal azul escura com pontos azuis nos extremos separa o logotipo do texto. Abaixo da linha, o texto \"TRANSFORMANDO DOCUMENTOS.\" está em azul escuro, seguido por \"GERANDO ACESSIBILIDADE.\" em verde. No final, há quatro ícones: um quadrado com seis pontos azuis, um ícone de volume, um ícone de olho e um ícone de documento com três linhas horizontais. Todos os elementos estão sobre um fundo branco.",
          "id": "blk-ded34735bd-1"
        }
      ],
      "children": []
    }
  ]
}